{
  "schema_version": "agent_episode_create.v1",
  "client_episode_id": "client_ep_01J0ACR001",
  "idempotency_key": "idem_01J0ACR001",
  "context_packet_id": "pkt_01J0ACR001",
  "goal": "Add repository-scoped ACR credentials",
  "task_ref": "CHAOS-2924",
  "repository": {
    "slug": "full-chaos/dev-health-acr",
    "remote_url": "https://github.com/full-chaos/dev-health-acr"
  },
  "scope": {
    "branch": "main",
    "commit_sha": "22e472d"
  },
  "client": {
    "name": "claude-code",
    "version": "1.0",
    "sidecar_version": "0.1.0",
    "agent_name": "coding-agent",
    "model": "example-model"
  },
  "started_at": "2026-07-10T14:01:00Z",
  "ended_at": "2026-07-10T14:10:00Z",
  "outcome": "succeeded",
  "summary": "Added repository-scoped credential model and denial tests.",
  "artifacts": {
    "files_touched": [
      "internal/auth/token.go"
    ],
    "artifact_uris": [
      "https://github.com/full-chaos/dev-health-acr/pull/1"
    ],
    "tests_run": [
      "go test ./..."
    ]
  },
  "transcript": {
    "mode": "none"
  },
  "retention_class": "default_90d"
}
